sl,text,aspect,sentiment,Issues,Battery,External,Internal,Screen,Service,Software
1802,Now the machine wo n't connect and Toshiba says that they did replace the connection card in May but they only warranty the repair for 30 days and now I 'm out of warranty even though this has been a constant 5 month occurance since I bought the netbook .,warranty,-1,Service,0,0,0,0,1,0
1803,"But , buy this model and just purchase 4GB of RAM -LRB- 2x2GB for $ 92 or 1x4GB for $ 99 -RRB- , and save yourself $ 100 than the other model with 8GB of RAM .",4GB of RAM,0,Internal,0,0,1,0,0,0
1804,"But , buy this model and just purchase 4GB of RAM -LRB- 2x2GB for $ 92 or 1x4GB for $ 99 -RRB- , and save yourself $ 100 than the other model with 8GB of RAM .",8GB of RAM,0,Internal,0,0,1,0,0,0
1808,"Again , decent comp for the price , and I was in need of one quickly as my other laptop died on me .",price,1,Service,0,0,0,0,1,0
1809,so in a brief summary i would have to say that i would not recommend dell vostro 1000 to anyone due to it being a down right awful setup so in my opinion you should steer clear of them if you want a decent laptop .,setup,-1,Software,0,0,0,0,0,1
1810,"My friend just had to replace his entire motherboard , so did my wife , and it looks like I will have to as well .",motherboard,-1,Internal,0,0,1,0,0,0
1811,"Toshiba customer services will indirectly deal with your problems by constantly tranferring you from one country to another , and I am not kidding you , I called different hours of the day and you 'll get someone else from another country trying to get you to tell them your life story all over again , since they make it sound like they do n't have your history list of your calls right in front of them .",Toshiba customer services,-1,Service,0,0,0,0,1,0
1812,Quality Display I was surprised with the performance and quality of this HP Laptop .,Quality Display,1,Screen,0,0,0,1,0,0
1813,Quality Display I was surprised with the performance and quality of this HP Laptop .,performance,1,Software,0,0,0,0,0,1
1814,Quality Display I was surprised with the performance and quality of this HP Laptop .,quality,1,Service,0,0,0,0,1,0
1815,The battery life also does n't keep up with the claim but still I think macbook is much ahead from the rest of the pack .,battery life,-1,Battery,1,0,0,0,0,0
1816,The internet capabilities are also very strong and picks up signals very easily .,internet capabilities,1,Internal,0,0,1,0,0,0
1818,Another Great thing is the Beast graphics .,Beast graphics,1,Internal,0,0,1,0,0,0
1820,Everything I have tried has worked and I never have to carry the wall charger cause the battery is so awesome .,wall charger,0,Battery,1,0,0,0,0,0
1821,Everything I have tried has worked and I never have to carry the wall charger cause the battery is so awesome .,battery,1,Battery,1,0,0,0,0,0
1822,The battery life is probably an hour at best .,battery life,-1,Battery,1,0,0,0,0,0
1824,"cosmetically , the only thing they changed was 2 of the Function keys at the top .",Function keys,0,Software,0,0,0,0,0,1
1825,But sadly the replacement froze-up while updating the BIOS again and shut down and would not turn back on .,BIOS,-1,Software,0,0,0,0,0,1
1826,There 's literally no way to make it sing with Vista .,Vista,-1,Software,0,0,0,0,0,1
1827,Screen size is perfect for portable use in any environment .,Screen size,1,Screen,0,0,0,1,0,0
1828,"First , it does not have a push button to open the lid .",push button,-1,External,0,1,0,0,0,0
1831,"I used to build my own desktops from the component parts , and recently my 7 year old Pentium 4 with HT 1 GB ram SATA desktop stopped working -LRB- this was a rock star 7 years ago -RRB- .",1 GB ram,0,Internal,0,0,1,0,0,0
1832,I now realize that my $ 900 would have been better spent on a Windows laptop .,Windows,1,Software,0,0,0,0,0,1
1833,-RRB- And printing from either word processor is an adventure .,word processor,-1,Software,0,0,0,0,0,1
1834,"After purchasing this thing , I find out that I need a special interface device to connect my camera , and that it can not be purchased at the store - only on line .",interface device,-1,External,0,1,0,0,0,0
1835,Another included program that is laughable is the chess game .,included program,-1,Software,0,0,0,0,0,1
1837,"It works great for general internet use , Microsoft Office apps , home bookkeeping , etc. .",Microsoft Office apps,1,Software,0,0,0,0,0,1
1839,"The price was very good , and the product is top quality .",price,1,Service,0,0,0,0,1,0
1840,"The price was very good , and the product is top quality .",quality,1,Service,0,0,0,0,1,0
1841,It played various games without problems and ran aero smoothly and flawlessly .,games,0,Software,0,0,0,0,0,1
1843,After replacing the hard drive the battery stopped working -LRB- 3 months of use -RRB- which was frustrating .,hard drive,0,Internal,0,0,1,0,0,0
1844,After replacing the hard drive the battery stopped working -LRB- 3 months of use -RRB- which was frustrating .,battery,-1,Battery,1,0,0,0,0,0
1845,The screen almost looked like a barcode when it froze .,screen,-1,Screen,0,0,0,1,0,0
1847,"Its small enough where I can take it pretty much anywhere , but still has a big enough screen to get everything done .",screen,1,Screen,0,0,0,1,0,0
1848,"It even has a great webcam , and Skype works very well .",webcam,1,External,0,1,0,0,0,0
1849,"It even has a great webcam , and Skype works very well .",Skype,1,Software,0,0,0,0,0,1
1851,"I love the solid machined aluminum frame , and the keyboard is the best of any laptop I 've used .",keyboard,1,External,0,1,0,0,0,0
1853,You can even run a parallels type program easily and run any leftover PC software that you absolutely can not be without .,software,1,Software,0,0,0,0,0,1
1855,"The ATI graphics card is a huge plus , definitely a good value if you need to be able to run some slightly older games that a Intel built-in card would have trouble with , such as Half-Life 2 or even World of Warcraft .",ATI graphics card,1,Internal,0,0,1,0,0,0
1856,"The ATI graphics card is a huge plus , definitely a good value if you need to be able to run some slightly older games that a Intel built-in card would have trouble with , such as Half-Life 2 or even World of Warcraft .",Intel built-in card,1,Internal,0,0,1,0,0,0
1857,"The ATI graphics card is a huge plus , definitely a good value if you need to be able to run some slightly older games that a Intel built-in card would have trouble with , such as Half-Life 2 or even World of Warcraft .",games,0,Software,0,0,0,0,0,1
1860,It has easy to use features and all the speed and power I could ask for .,features,1,Internal,0,0,1,0,0,0
1862,It has easy to use features and all the speed and power I could ask for .,power,1,Battery,1,0,0,0,0,0
1863,"My power supply cord developed exposed wires within the first year of ownership , so it was covered by the Applecare warranty plan .",power supply cord,-1,Battery,1,0,0,0,0,0
1864,"My power supply cord developed exposed wires within the first year of ownership , so it was covered by the Applecare warranty plan .",Applecare warranty plan,1,Service,0,0,0,0,1,0
1866,power supply went bad after 2 weeks --,power supply,-1,Battery,1,0,0,0,0,0
1867,"The screen takes some getting use to , because it is smaller than the laptop .",screen,-1,Screen,0,0,0,1,0,0
1869,The right speaker did not work .,right speaker,-1,External,0,1,0,0,0,0
1870,Dealing with the support drone on the other end of the chat was sheer torture .,support,-1,Service,0,0,0,0,1,0
1874,"The Mac Snow Leopard O/S is extremely easy to use , although very different than Win XP , Visa or Win7 .",Win XP,0,Software,0,0,0,0,0,1
1876,"The Mac Snow Leopard O/S is extremely easy to use , although very different than Win XP , Visa or Win7 .",Win7,0,Software,0,0,0,0,0,1
1881,"The screen is nice and the images comes very clear , the keyboard and the fit just feels right .",screen,1,Screen,0,0,0,1,0,0
1882,"The screen is nice and the images comes very clear , the keyboard and the fit just feels right .",keyboard,1,External,0,1,0,0,0,0
1884,I have only had PCs with Windows before so this takes a little getting use to .,Windows,0,Software,0,0,0,0,0,1
1885,super fast processor and really nice graphics card . .,processor,1,Internal,0,0,1,0,0,0
1886,super fast processor and really nice graphics card . .,graphics card,1,Internal,0,0,1,0,0,0
1887,"But sitting on a lap or on a desk in front of you it looks more than big enough -LRB- this could be because Im used to my Lenovo 10 tablet now -RRB- plus this is a great size if I want to unplug the external keyboard , mouse , and monitor to take it with me when I take photos and video .",size,1,Screen,0,0,0,1,0,0
1888,"But sitting on a lap or on a desk in front of you it looks more than big enough -LRB- this could be because Im used to my Lenovo 10 tablet now -RRB- plus this is a great size if I want to unplug the external keyboard , mouse , and monitor to take it with me when I take photos and video .",external keyboard,0,External,0,1,0,0,0,0
1889,"But sitting on a lap or on a desk in front of you it looks more than big enough -LRB- this could be because Im used to my Lenovo 10 tablet now -RRB- plus this is a great size if I want to unplug the external keyboard , mouse , and monitor to take it with me when I take photos and video .",mouse,0,External,0,1,0,0,0,0
1890,"But sitting on a lap or on a desk in front of you it looks more than big enough -LRB- this could be because Im used to my Lenovo 10 tablet now -RRB- plus this is a great size if I want to unplug the external keyboard , mouse , and monitor to take it with me when I take photos and video .",monitor,0,External,0,1,0,0,0,0
1891,The only objection I have is that after you buy it the windows 7 system is a starter and charges for the upgrade .,windows 7 system,-1,Software,0,0,0,0,0,1
1893,"I dislike the weight and size , cubersome .",size,-1,Screen,0,0,0,1,0,0
1895,I can not be happier with the service or product .,service,1,Service,0,0,0,0,1,0
1896,"I do transcription work on the side , and the flatline keyboard makes typing quick and easy as well .",flatline keyboard,1,External,0,1,0,0,0,0
1897,Speakers does n't sound that great .,Speakers,-1,External,0,1,0,0,0,0
1898,"I love windows 7 but i ca n't give Toshiba any credit for that , unless y' all get serious about ergonomics and making required connections less obtrusive i will be looking to different manufacturer next time .",windows 7,1,Software,0,0,0,0,0,1
1901,"After numerous calls to Applecare tech support , I was directed to send in my computer ;",Applecare tech support,-1,Service,0,0,0,0,1,0
1902,The `` abuse '' is that I pushed the power plug in too hard .,power plug,-1,Battery,1,0,0,0,0,0
1903,The resolution on the screen is almost pure HD .,resolution on the screen,1,Screen,0,0,0,1,0,0
1904,"With all the programs that came with it , such as iLife and iWork , I was set from the very beginning .",programs,0,Software,0,0,0,0,0,1
1907,"Not sure how I recommend it for quality gaming , as I have a desktop rig for that reason .",gaming,-1,Software,0,0,0,0,0,1
1908,"Great value , fast delivery - Computer works as if brand new , no problems , very pleased",delivery,1,Service,0,0,0,0,1,0
1910,The Internet Explorer was very slow from the very beginning .,Internet Explorer,-1,Software,0,0,0,0,0,1
1911,The AC power port becomes loose over time,AC power port,-1,Battery,1,0,0,0,0,0
1912,"As a user of a PC , I will will admit that the macBook Pro has a better running system in which I found myself `` Getting the job done quicker .",running system,1,Software,0,0,0,0,0,1
1913,"There are no gold key numbers too intall programs , you must use the serial numbers that it does not accept and then things are limited as far a working because they are only good for a short time .",programs,-1,Software,0,0,0,0,0,1
1914,and they replaced the awesome ergonomic small lightweight power supply with a power supply that weighed more than the machine itself .,power supply,1,Battery,1,0,0,0,0,0
1915,and they replaced the awesome ergonomic small lightweight power supply with a power supply that weighed more than the machine itself .,power supply,-1,Battery,1,0,0,0,0,0
1920,"We love the size of the screen , although it is still lightweight and very easy to tote around .",size of the screen,1,Screen,0,0,0,1,0,0
1924,the battery is irreplaceable .,battery,-1,Battery,1,0,0,0,0,0
1925,"If you want a little more custom ability , drop a few bucks and upgrade to one of the more robust versions of Win 7 and grab a 2GB stick of memory to spice it all up a bit more .",Win 7,1,Software,0,0,0,0,0,1
1926,"If you want a little more custom ability , drop a few bucks and upgrade to one of the more robust versions of Win 7 and grab a 2GB stick of memory to spice it all up a bit more .",2GB stick of memory,1,Internal,0,0,1,0,0,0
1928,"The internet was locekd and froze every time it was trying to be used , and the command prompt would not work at all .",internet,-1,Software,0,0,0,0,0,1
1929,"The internet was locekd and froze every time it was trying to be used , and the command prompt would not work at all .",command prompt,-1,Software,0,0,0,0,0,1
1930,It 's software and speed enable it to do amazing things .,software,1,Software,0,0,0,0,0,1
1932,Could not keep up with me and finally the hard drive went out .,hard drive,-1,Internal,0,0,1,0,0,0
1933,"I am most impressed with the programming , including the iPhoto .",programming,1,Software,0,0,0,0,0,1
1934,"I am most impressed with the programming , including the iPhoto .",iPhoto,1,Software,0,0,0,0,0,1
1935,Speakers too small to be of any real use .,Speakers,-1,External,0,1,0,0,0,0
1936,"I upgraded it 's RAM to 2GB , I am very happy with it .",RAM,1,External,0,1,0,0,0,0
1937,I purchased a Toshiba Satellite M60 -LRB- with harman/kardon speakers ! -RRB- in December of 2005 .,speakers,1,External,0,1,0,0,0,0
1938,They should have included more memory on their computers if they knew Vista would run slowly .,memory,-1,Internal,0,0,1,0,0,0
1939,They should have included more memory on their computers if they knew Vista would run slowly .,Vista,-1,Software,0,0,0,0,0,1
1940,Battery life could be better but overall for the price and Toshiba 's reputation for laptops it 's great !,Battery life,-1,Battery,1,0,0,0,0,0
1941,Battery life could be better but overall for the price and Toshiba 's reputation for laptops it 's great !,price,1,Service,0,0,0,0,1,0
1942,"The battery never held a charge longer than one hour and within two months , stopped holding a charge for more than ten minutes .",battery,-1,Battery,1,0,0,0,0,0
1943,"The battery never held a charge longer than one hour and within two months , stopped holding a charge for more than ten minutes .",charge,-1,Battery,1,0,0,0,0,0
1944,"The battery never held a charge longer than one hour and within two months , stopped holding a charge for more than ten minutes .",charge,-1,Battery,1,0,0,0,0,0
1945,After the warrenty expired the hard drive went bad and it would have cost more to fix then to replace .,warrenty,0,Service,0,0,0,0,1,0
1946,After the warrenty expired the hard drive went bad and it would have cost more to fix then to replace .,hard drive,-1,Internal,0,0,1,0,0,0
1947,"The Windows 7 Starter is , in my opinion , a great way to think about using your netbook : basics , basics , basics .",Windows 7 Starter,1,Software,0,0,0,0,0,1
1949,The neat and organized icon list is a welcome change from cluttered and confusing desktop icons .,desktop icons,-1,Software,0,0,0,0,0,1
1950,I purchased this netbook after my original Toshiba laptop crashed right after the warranty expired .,warranty,-1,Service,0,0,0,0,1,0
1951,"Apparently well-built and gorgeous to look at , the i5 MacBook Pro is a winning combination of price and performance .",price,1,Service,0,0,0,0,1,0
1952,"Apparently well-built and gorgeous to look at , the i5 MacBook Pro is a winning combination of price and performance .",performance,1,Software,0,0,0,0,0,1
1954,"Apparently well-built and gorgeous to look at , the i5 MacBook Pro is a winning combination of price and performance .",look,1,External,0,1,0,0,0,0
1957,"So I called Compaq , and after being on the phone for 3 hours , i finally got a replacement which I should n't have had a problem getting since it was under warranty .",warranty,0,Service,0,0,0,0,1,0
1959,"I love the size , keyboard , the functions .",size,1,Screen,0,0,0,1,0,0
1960,"I love the size , keyboard , the functions .",keyboard,1,External,0,1,0,0,0,0
1962,the mouse is way way way to sensitve .,mouse,-1,External,0,1,0,0,0,0
1963,The OS is still as fast as the day that the laptop was purchased and continues to run flawlessly .,OS,1,Software,0,0,0,0,0,1
1965,"Also , I issued a replacement RMA for a few dead pixels in the upper zone of the screen , which is noticable to me .",screen,-1,Screen,0,0,0,1,0,0
1966,"After way too many times sending the thing in for repairs -LRB- delivery service was slow , and without the laptop I had no access to the internet , and thus no way of tracking it to find out when I might hope to see my computer again -RRB- , it finally kicked the bucket after just over 2 years .",delivery service,-1,Service,0,0,0,0,1,0
1967,"My friend reports the notebook is astonishing in performance , picture quality , and ease of use .",performance,1,Software,0,0,0,0,0,1
1970,the i3 processor does n't seem to run hot and the fan rarely turns on .,i3 processor,1,Internal,0,0,1,0,0,0
1971,the i3 processor does n't seem to run hot and the fan rarely turns on .,fan,1,External,0,1,0,0,0,0
1972,"The battery never held a charge longer than one hour and within two months , stopped holding a charge for more than ten minutes .",battery,-1,Battery,1,0,0,0,0,0
1973,"The battery never held a charge longer than one hour and within two months , stopped holding a charge for more than ten minutes .",charge,-1,Battery,1,0,0,0,0,0
1974,"The battery never held a charge longer than one hour and within two months , stopped holding a charge for more than ten minutes .",charge,-1,Battery,1,0,0,0,0,0
1975,"Another THREE weeks later I had my laptop back with a new mousepad , keys , and casing .",mousepad,0,External,0,1,0,0,0,0
1976,"Another THREE weeks later I had my laptop back with a new mousepad , keys , and casing .",keys,0,Software,0,0,0,0,0,1
1977,"Another THREE weeks later I had my laptop back with a new mousepad , keys , and casing .",casing,0,External,0,1,0,0,0,0
1978,See when it comes to laptops you buy it and get just a normal operating system with trials of must need stuff that should come with it .,operating system,0,Software,0,0,0,0,0,1
1979,"The only thing I do n't understand is that the resolution of the screen is n't high enough for some pages , such as Yahoo!Mail .",resolution of the screen,-1,Screen,0,0,0,1,0,0
1980,The only thing I wish this had was the option to turn off the touchpad with a button like my big 16 '' laptop does .,touchpad,-1,Internal,0,0,1,0,0,0
1981,very convenient when you travel and the battery life is excellent ...,battery life,1,Battery,1,0,0,0,0,0
1982,The machine is slow to boot up and occasionally crashes completely .,boot up,-1,Software,0,0,0,0,0,1
1983,This is great if you have several lectures back to back and do n't have a chance to charge during one of the lectures .,charge,1,Battery,1,0,0,0,0,0
1984,I wish Toshiba would allow their customers to select an option that only boots the OS at setup and removes all the unnecessary stuff .,OS,0,Software,0,0,0,0,0,1
1985,the screen brightness automatically adjusts .,screen brightness,0,Screen,0,0,0,1,0,0
1987,"Besides the great look , it is a great machine .",look,1,External,0,1,0,0,0,0
1989,"The sound is a bit quiet if you 're on a plane , this can easily be overcome with a decent pair of head phones .",sound,-1,External,0,1,0,0,0,0
1990,-LRB- The SATA controller is the motherboard chip that lets the CPU talk to the hard drive . -RRB-,SATA controller,0,External,0,1,0,0,0,0
1991,-LRB- The SATA controller is the motherboard chip that lets the CPU talk to the hard drive . -RRB-,motherboard chip,0,Internal,0,0,1,0,0,0
1993,-LRB- The SATA controller is the motherboard chip that lets the CPU talk to the hard drive . -RRB-,hard drive,0,Internal,0,0,1,0,0,0
1994,The buttons you have to press a little harder than most .,buttons,-1,External,0,1,0,0,0,0
1995,"The battery life was supposed to be 6 hours , but even if I ran off the battery with the high effeciency setting the battery would only last me on average about 2.5 to 3 hours .",battery life,-1,Battery,1,0,0,0,0,0
1996,"The battery life was supposed to be 6 hours , but even if I ran off the battery with the high effeciency setting the battery would only last me on average about 2.5 to 3 hours .",battery,0,Battery,1,0,0,0,0,0
1997,"The battery life was supposed to be 6 hours , but even if I ran off the battery with the high effeciency setting the battery would only last me on average about 2.5 to 3 hours .",battery,-1,Battery,1,0,0,0,0,0
1998,Right size and weight for portability .,size,1,Screen,0,0,0,1,0,0
2001,The battery life also does n't keep up with the claim but still I think macbook is much ahead from the rest of the pack .,battery life,-1,Battery,1,0,0,0,0,0
2002,"It was loaded with Windows Vista Home Premium -- delivered with only 1GB of RAM , and it was a * dog * .",Windows Vista Home Premium,0,Software,0,0,0,0,0,1
2003,"It was loaded with Windows Vista Home Premium -- delivered with only 1GB of RAM , and it was a * dog * .",1GB of RAM,-1,Internal,0,0,1,0,0,0
2004,The reflectiveness of the display is only a minor inconvenience if you work in a controlled-lighting environment like me -LRB- I prefer it dark -RRB- or if you can crank up the brightness .,display,-1,Screen,0,0,0,1,0,0
2005,The reflectiveness of the display is only a minor inconvenience if you work in a controlled-lighting environment like me -LRB- I prefer it dark -RRB- or if you can crank up the brightness .,brightness,0,Screen,0,0,0,1,0,0
2006,My one complaint with this laptop is that I 've noticed an electronic fuzz sound coming out of the headphone jack when headphones are plugged in .,electronic fuzz sound,-1,Internal,0,0,1,0,0,0
2007,My one complaint with this laptop is that I 've noticed an electronic fuzz sound coming out of the headphone jack when headphones are plugged in .,headphone jack,-1,External,0,1,0,0,0,0
2008,"While it was highly rated , would I like it ? I tried the keyboard at the store , and it seemed ok .",keyboard,0,External,0,1,0,0,0,0
2009,"Treat yourself to a more expensive , long-lasting laptop of quality like a Sony , Apple , or Toshiba .",quality,1,Service,0,0,0,0,1,0
2010,"I have had to call with a few questions or issues and they have helped me for free , even without the warranty .",warranty,0,Service,0,0,0,0,1,0
2011,Was searching online for a power supply when I found this site .,power supply,0,Battery,1,0,0,0,0,0
2012,"But to be honest , I do n't use my computer for anything like graphics editing and complex data analysis and gaming .",gaming,0,Software,0,0,0,0,0,1
2013,"But to be honest , I do n't use my computer for anything like graphics editing and complex data analysis and gaming .",graphics editing,0,Internal,0,0,1,0,0,0
2016,-LRB- No problem with the ordering or shipping by the way .,shipping,1,Service,0,0,0,0,1,0
2017,And the ram -LRB- the thing that makes it faster -RRB- comes sporting 2 gigs for high performance to handle more stuff at once and surf the web a whole lot faster than before .,ram,1,Internal,0,0,1,0,0,0
2018,And the ram -LRB- the thing that makes it faster -RRB- comes sporting 2 gigs for high performance to handle more stuff at once and surf the web a whole lot faster than before .,performance,1,Software,0,0,0,0,0,1
2020,The one thing I wish it had was a detailed hardcopy manuel .,hardcopy manuel,-1,External,0,1,0,0,0,0
2021,"I edit and burn to DVD a lot of video , so I obviously could not live with a non-functioning drive .",drive,-1,Internal,0,0,1,0,0,0
2025,You will need them if you want to reload the OS -LRB- I recommend doing if you can to start fresh and optimal -RRB- .,OS,0,Software,0,0,0,0,0,1
2026,"while the keyboard itself is alright , the plate around it is cheap plastic and makes a hollow sound when using the mouse command buttons .",keyboard,1,External,0,1,0,0,0,0
2028,"while the keyboard itself is alright , the plate around it is cheap plastic and makes a hollow sound when using the mouse command buttons .",mouse command buttons,-1,External,0,1,0,0,0,0
2029,There are so many wonderful features and benefits to the new MacBook !,features,1,Internal,0,0,1,0,0,0
2031,The only thing i can say is that the touch pad doesnt work like it should all the time .,touch pad,-1,Internal,0,0,1,0,0,0
2032,"However , I love this particular Mac because its very fast , great size , and has fantastic features like the lighted keyboard and easy mouse pad .",size,1,Screen,0,0,0,1,0,0
2033,"However , I love this particular Mac because its very fast , great size , and has fantastic features like the lighted keyboard and easy mouse pad .",features,1,Internal,0,0,1,0,0,0
2034,"However , I love this particular Mac because its very fast , great size , and has fantastic features like the lighted keyboard and easy mouse pad .",lighted keyboard,1,External,0,1,0,0,0,0
2035,"However , I love this particular Mac because its very fast , great size , and has fantastic features like the lighted keyboard and easy mouse pad .",mouse pad,1,External,0,1,0,0,0,0
2036,Battery life needs more life .,Battery life,-1,Battery,1,0,0,0,0,0
2037,For some odd reasons the computer does n't reconize the operation system .,operation system,-1,Software,0,0,0,0,0,1
2038,The trackpad was easy to learn and navigate .,trackpad,1,External,0,1,0,0,0,0
2039,"Applications open in seconds and there are no lags , hiccups or awkward moments when you wonder whether your computer is out for tea .",Applications,1,Software,0,0,0,0,0,1
