sl,text,aspect,sentiment,Issues,Battery,External,Internal,Screen,Service,Software
522,The size is perfect and I do not recomend anything bigger except for any person who can exceed the limited space it gives you .,space,-1,Internal,0,0,1,0,0,0
523,The service I received from Toshiba went above and beyond the call of duty .,service,1,Service,0,0,0,0,1,0
524,"Have had many higher priced computers crash and burn long before ever got to use all that great memory and speed , etc. .",memory,-1,Internal,0,0,1,0,0,0
527,I would recommend it just because of the internet speed probably because thats the only thing i really care about .,internet speed,1,Internal,0,0,1,0,0,0
528,"There are several programs for school or office use -LRB- Pages , Numbers , Keynote , etc. -RRB- , music -LRB- Garageband -RRB- , photo management -LRB- Photo Booth , iPhoto -RRB- , video-editing or movie-making -LRB- iMovie -RRB- , etc. .",programs,0,Software,0,0,0,0,0,1
531,"There are several programs for school or office use -LRB- Pages , Numbers , Keynote , etc. -RRB- , music -LRB- Garageband -RRB- , photo management -LRB- Photo Booth , iPhoto -RRB- , video-editing or movie-making -LRB- iMovie -RRB- , etc. .",iPhoto,0,Software,0,0,0,0,0,1
533,"There are several programs for school or office use -LRB- Pages , Numbers , Keynote , etc. -RRB- , music -LRB- Garageband -RRB- , photo management -LRB- Photo Booth , iPhoto -RRB- , video-editing or movie-making -LRB- iMovie -RRB- , etc. .",video-editing,0,Software,0,0,0,0,0,1
534,"There are several programs for school or office use -LRB- Pages , Numbers , Keynote , etc. -RRB- , music -LRB- Garageband -RRB- , photo management -LRB- Photo Booth , iPhoto -RRB- , video-editing or movie-making -LRB- iMovie -RRB- , etc. .",movie-making,0,Software,0,0,0,0,0,1
535,"There are several programs for school or office use -LRB- Pages , Numbers , Keynote , etc. -RRB- , music -LRB- Garageband -RRB- , photo management -LRB- Photo Booth , iPhoto -RRB- , video-editing or movie-making -LRB- iMovie -RRB- , etc. .",photo management,0,Software,0,0,0,0,0,1
539,"There are several programs for school or office use -LRB- Pages , Numbers , Keynote , etc. -RRB- , music -LRB- Garageband -RRB- , photo management -LRB- Photo Booth , iPhoto -RRB- , video-editing or movie-making -LRB- iMovie -RRB- , etc. .",Keynote,0,Software,0,0,0,0,0,1
541,The screen shows great colors .,screen,1,Screen,0,0,0,1,0,0
544,"Reason why ? It 's because when you buy it , you know first thing that you will not lose any value for that laptop , the price will stay the same for the next year , and even if Apple does decides to change mode , your laptop value will only drop 10-20 % , unlike PC laptops which drop more than 80 % .",price,1,Service,0,0,0,0,1,0
546,"I have no idea how to burn cd 's or to use the web cam , just for starters .",web cam,0,Internal,0,0,1,0,0,0
548,"The 17 inch screen is very large , but the computer is very light .",17 inch screen,-1,Screen,0,0,0,1,0,0
549,"My opinion of Sony has been dropping as fast as the stock market , given their horrible support , but this machine just caused another plunge .",support,-1,Service,0,0,0,0,1,0
550,"For the Bluetooth to work properly , you must install the Launch Manager on the Drivers/Applications DVD , or it will not show after the reload .",Bluetooth,0,Internal,0,0,1,0,0,0
553,I also liked the glass screen .,glass screen,1,Screen,0,0,0,1,0,0
555,The switchable graphic card is pretty sweet when you want gaming on the laptop .,gaming,0,Software,0,0,0,0,0,1
556,"It 's not a wear-and-tear issue , not due to user carelessness and most importantly , they CA N'T guarantee the problem will be solved if it is sent for service and I have to accept the outcome .",service,-1,Service,0,0,0,0,1,0
557,"The battery life has not decreased since I bought it , so i 'm thrilled with that .",battery life,1,Battery,1,0,0,0,0,0
561,The price and features more than met my needs .,price,1,Service,0,0,0,0,1,0
562,The price and features more than met my needs .,features,1,Internal,0,0,1,0,0,0
563,Skype is just so dang cool with this machine too .,Skype,1,Software,0,0,0,0,0,1
564,the mouse buttons are hard to push .,mouse buttons,-1,External,0,1,0,0,0,0
565,"Also , HDD secures inside using rails , and there is only one set on the main hard drive .",HDD,1,Internal,0,0,1,0,0,0
567,"Also , HDD secures inside using rails , and there is only one set on the main hard drive .",hard drive,0,Internal,0,0,1,0,0,0
568,All I will say now is that it was over two grand less expensive and so much better quality than my hunk of crap Vaio .,quality,1,Service,0,0,0,0,1,0
569,"-LRB- Beware , their staff could send you back making you feel that only they know what a computer is .",staff,-1,External,0,1,0,0,0,0
570,Games being the main issue .,Games,-1,Software,0,0,0,0,0,1
572,They say that this will invalidate the warranty on the hard drive -LRB- I do n't really understand why but anyway -RRB- .,warranty,-1,Service,0,0,0,0,1,0
573,They say that this will invalidate the warranty on the hard drive -LRB- I do n't really understand why but anyway -RRB- .,hard drive,0,Internal,0,0,1,0,0,0
574,and looks very sexyy :D really the mac book pro is the best laptop specially for students in college if you are not caring about price .,price,-1,Service,0,0,0,0,1,0
577,"Even with virus protection , it always turned off when updates were needed and installed .",virus protection,-1,Software,0,0,0,0,0,1
578,"Even with virus protection , it always turned off when updates were needed and installed .",updates,-1,Software,0,0,0,0,0,1
581,"Even so , I like playing online games , so it was wonderful that there is a feature where I can dualboot Windows .",Windows,1,Software,0,0,0,0,0,1
582,"Even so , I like playing online games , so it was wonderful that there is a feature where I can dualboot Windows .",games,0,Software,0,0,0,0,0,1
583,The battery life is amazingly long at 7hrs and 5hrs if you use it .,battery life,1,Battery,1,0,0,0,0,0
584,"lightweight , long battery life , excellent transition from PC ;",battery life,1,Battery,1,0,0,0,0,0
585,The price is another driving influence that made me purchase this laptop .,price,1,Service,0,0,0,0,1,0
588,I am first time Mac Buyer and am amazed at features and ease of use the Mac offers .,features,1,Internal,0,0,1,0,0,0
591,"I noticed windows has a new system called Windows 7 , what about us Vista users ? They should get all the bugs out of Vista before investing in a new system .",Windows 7,0,Software,0,0,0,0,0,1
592,"I noticed windows has a new system called Windows 7 , what about us Vista users ? They should get all the bugs out of Vista before investing in a new system .",Vista,0,Software,0,0,0,0,0,1
593,"I noticed windows has a new system called Windows 7 , what about us Vista users ? They should get all the bugs out of Vista before investing in a new system .",Vista,-1,Software,0,0,0,0,0,1
594,"I noticed windows has a new system called Windows 7 , what about us Vista users ? They should get all the bugs out of Vista before investing in a new system .",windows,0,Software,0,0,0,0,0,1
595,"When we bought our new HP comouter in Dec. of 2008 , we wanted Windows XP , but were told it would cost an extra $ 159 , so we went with Vista .",Vista,0,Software,0,0,0,0,0,1
596,"The only thing that I have , is the key broad is a little dark to see the letters , would help if it was a little lighter then it is .",key broad,-1,External,0,1,0,0,0,0
597,I 'm still within the one year warranty but the repair `` depot '' has deemed that this time it was caused by physical abuse and is not covered .,warranty,-1,Service,0,0,0,0,1,0
601,I would like at least a 4 hr . battery life .,battery life,0,Battery,1,0,0,0,0,0
602,The only thing that I do n't like about my mac is that sometimes there are programs that I want to be able to run and I am not able to .,programs,-1,Software,0,0,0,0,0,1
603,"Wireless has not been a issue for me , like some others have meantioned .",Wireless,1,External,0,1,0,0,0,0
604,"MacBook Notebooks quickly die out because of their short battery life , as well as the many background programs that run without the user 's knowlede .",battery life,-1,Battery,1,0,0,0,0,0
605,"MacBook Notebooks quickly die out because of their short battery life , as well as the many background programs that run without the user 's knowlede .",programs,-1,Software,0,0,0,0,0,1
606,"All the things you can do with the trackpad make navigating around the computer and its programs so much simpler , quicker , and easier .",trackpad,1,External,0,1,0,0,0,0
607,"All the things you can do with the trackpad make navigating around the computer and its programs so much simpler , quicker , and easier .",programs,1,Software,0,0,0,0,0,1
609,I guess the only good thing that came out of these were the speakers and the subwoofer .,speakers,1,External,0,1,0,0,0,0
610,I guess the only good thing that came out of these were the speakers and the subwoofer .,subwoofer,1,External,0,1,0,0,0,0
611,Theres a built in camera with special effects - for video and photography .,built in camera,1,Internal,0,0,1,0,0,0
612,All for such a great price .,price,1,Service,0,0,0,0,1,0
613,"Long story short , since I experience so many problems with my laptop every since I bought it from day one , I did n't ask for a new laptop or a refund of what I pay for a crapy laptop , but just an extension of my laptop warranty for another year , they made a big deal of out that and after so many calls and complaints about their products and services , they finally gave in .",warranty,0,Service,0,0,0,0,1,0
614,Another thing is that after only a month the left mouse key broke and it costed $ 175 to send it in to fix it .,left mouse key,-1,External,0,1,0,0,0,0
617,It has good speed and plenty of hard drive space .,hard drive space,1,Internal,0,0,1,0,0,0
619,"They said that my computer was covered on an extended warranty , and that products with extended warranties are taken care of through third parties and not Sony itself anymore .",extended warranty,0,Service,0,0,0,0,1,0
620,"They said that my computer was covered on an extended warranty , and that products with extended warranties are taken care of through third parties and not Sony itself anymore .",extended warranties,0,Service,0,0,0,0,1,0
621,Very long-life battery -LRB- up to 10-11 hours depending on how you configure power level settings -RRB- .,battery,1,Battery,1,0,0,0,0,0
622,"Screen is awesome , battery life is good .",Screen,1,Screen,0,0,0,1,0,0
623,"Screen is awesome , battery life is good .",battery life,1,Battery,1,0,0,0,0,0
624,The black model also has a very nice seamless appearance - one of the better looking notebooks I 've seen .,appearance,1,External,0,1,0,0,0,0
626,The graphics were awful and the warranty is n't even worth the cheap payment on the computer .,graphics,-1,Internal,0,0,1,0,0,0
627,The graphics were awful and the warranty is n't even worth the cheap payment on the computer .,warranty,-1,Service,0,0,0,0,1,0
628,"They gave me a hard time yet again , but their was a malfunction in the battery itself , it did n't die .",battery,-1,Battery,1,0,0,0,0,0
629,"If you do n't feel comfortable doing it yourself , just buy the case and be happy , plus it looks nice , I bought the white one from Best Buy .",case,1,External,0,1,0,0,0,0
630,"you can find many laptops with the same performance and even better with lower price , but you can not find the look , easy , applications , and the experience in mac .",performance,0,Software,0,0,0,0,0,1
631,"you can find many laptops with the same performance and even better with lower price , but you can not find the look , easy , applications , and the experience in mac .",price,1,Service,0,0,0,0,1,0
632,"you can find many laptops with the same performance and even better with lower price , but you can not find the look , easy , applications , and the experience in mac .",look,1,External,0,1,0,0,0,0
633,"you can find many laptops with the same performance and even better with lower price , but you can not find the look , easy , applications , and the experience in mac .",applications,1,Software,0,0,0,0,0,1
635,When you call tech support you were routed to someone who was in another country and did not know what they were doing .,tech support,-1,Service,0,0,0,0,1,0
636,"It has come into good use for my finances , scheduling , my parents business expenses , and it is definitely amazing for gaming .",gaming,1,Software,0,0,0,0,0,1
638,I was taught to use Photoshop and was amazed .,Photoshop,1,Software,0,0,0,0,0,1
639,4gb of ram ...,ram,0,Internal,0,0,1,0,0,0
640,Somehow the system clock got messed up after reboot .,system clock,-1,Internal,0,0,1,0,0,0
641,"the only problem is that i had to add 1 gb RAM , the computer was kinda slow .",RAM,-1,External,0,1,0,0,0,0
643,"The driver updates do n't fix the issue , very frustrating .",driver updates,-1,Software,0,0,0,0,0,1
644,I will never go back to Windows !,Windows,-1,Software,0,0,0,0,0,1
647,"Bigger HD , better graphics card , and a bid HD .",HD,1,Battery,1,0,0,0,0,0
648,"Bigger HD , better graphics card , and a bid HD .",HD,1,Battery,1,0,0,0,0,0
649,"Bigger HD , better graphics card , and a bid HD .",graphics card,1,Internal,0,0,1,0,0,0
650,The built in camera is very useful when chatting with other techs in remote buildings on our campus .,built in camera,1,Internal,0,0,1,0,0,0
651,"Mine came at $ 1,700 w/o a DVD burner -LRB- ! -RRB- .",DVD burner,-1,External,0,1,0,0,0,0
652,The DVD burner broke after burning 3 DVD 'd during that time !,DVD burner,-1,External,0,1,0,0,0,0
654,But you must get the 15 inch .,15 inch,1,Screen,0,0,0,1,0,0
656,"Overall the computer is very easy to use , the screen is perfect , great computer , my daughter loves .",screen,1,Screen,0,0,0,1,0,0
658,The casing of the power cord fried and shocked my husband when he pulled it out of the socket .,casing of the power cord,-1,Battery,1,0,0,0,0,0
659,It does not keep internet signals no matter where you bring it .,internet signals,-1,Internal,0,0,1,0,0,0
660,It 's a great product for a great price !,price,1,Service,0,0,0,0,1,0
661,"Again , the same problem , the right speaker did not work .",right speaker,-1,External,0,1,0,0,0,0
662,But see the macbook pro is different because it may have a huge price tag but it comes with the full software that you would actually need and most of it has free future updates .,software,1,Software,0,0,0,0,0,1
663,But see the macbook pro is different because it may have a huge price tag but it comes with the full software that you would actually need and most of it has free future updates .,updates,1,Software,0,0,0,0,0,1
666,Keyboard good sized and wasy to use .,Keyboard,1,External,0,1,0,0,0,0
668,HP said it was out of warranty .,warranty,0,Service,0,0,0,0,1,0
669,"I never had this kind of quality issue with Dell -LRB- not to say Dell is that great -RRB- , not with a brand new laptop .",quality,-1,Service,0,0,0,0,1,0
670,wonderful features .,features,1,Internal,0,0,1,0,0,0
671,I had to call HP and ask for a recovery disk because the computer does not come with one and completely redo it all .,recovery disk,-1,Software,0,0,0,0,0,1
672,Im glad that it has such great features in it .,features,1,Internal,0,0,1,0,0,0
673,I like those programs better than Office and you can save your files to be completely compatible with the Office programs as well .,programs,1,Software,0,0,0,0,0,1
676,Great wifi too .,wifi,1,Internal,0,0,1,0,0,0
678,"Only a few days after I received the computer back , the screen froze again .",screen,-1,Screen,0,0,0,1,0,0
681,"Great OS , fabulous improvements to the existing line bumping up the processor speed and adding the thunderbolt port .",OS,1,Software,0,0,0,0,0,1
684,The lcd screen stopped working on mine after 10 months .,lcd screen,-1,Screen,0,0,0,1,0,0
686,although its windows vista compared to windows xp sucks .,windows vista,-1,Software,0,0,0,0,0,1
687,although its windows vista compared to windows xp sucks .,windows xp,1,Software,0,0,0,0,0,1
688,"We have had numerous problems with Vista , such as Adobe Flash player just quits and has to be uninstalled and then reinsalled , Internet Explore just quits and you lose whatever you were working on , also , the same Windows update has appeared on this computer since we got it and has been updated probably 400 times , the same update .",Vista,-1,Software,0,0,0,0,0,1
689,"We have had numerous problems with Vista , such as Adobe Flash player just quits and has to be uninstalled and then reinsalled , Internet Explore just quits and you lose whatever you were working on , also , the same Windows update has appeared on this computer since we got it and has been updated probably 400 times , the same update .",Adobe Flash player,-1,Software,0,0,0,0,0,1
690,"We have had numerous problems with Vista , such as Adobe Flash player just quits and has to be uninstalled and then reinsalled , Internet Explore just quits and you lose whatever you were working on , also , the same Windows update has appeared on this computer since we got it and has been updated probably 400 times , the same update .",Internet Explore,-1,Software,0,0,0,0,0,1
691,"We have had numerous problems with Vista , such as Adobe Flash player just quits and has to be uninstalled and then reinsalled , Internet Explore just quits and you lose whatever you were working on , also , the same Windows update has appeared on this computer since we got it and has been updated probably 400 times , the same update .",Windows update,-1,Software,0,0,0,0,0,1
692,"We have had numerous problems with Vista , such as Adobe Flash player just quits and has to be uninstalled and then reinsalled , Internet Explore just quits and you lose whatever you were working on , also , the same Windows update has appeared on this computer since we got it and has been updated probably 400 times , the same update .",update,-1,Software,0,0,0,0,0,1
693,with the switch being at the top you need to memorize the key combination rather than just flicking a switch .,switch,-1,External,0,1,0,0,0,0
694,with the switch being at the top you need to memorize the key combination rather than just flicking a switch .,switch,-1,External,0,1,0,0,0,0
696,It has bein into the shop to get a new hardrive 2 times and to fix the touch control buttons on the keyboard !,hardrive,-1,Internal,0,0,1,0,0,0
697,It has bein into the shop to get a new hardrive 2 times and to fix the touch control buttons on the keyboard !,touch control buttons,-1,External,0,1,0,0,0,0
698,It has bein into the shop to get a new hardrive 2 times and to fix the touch control buttons on the keyboard !,keyboard,-1,External,0,1,0,0,0,0
699,I always have used a tower home PC and jumped to the laptop and have been very satisfied with its performance .,performance,1,Software,0,0,0,0,0,1
700,"The computer runs very fast with no problems and the iLife software that comes with it -LRB- iPhoto , iMovie , iWeb , iTunes , GarageBand -RRB- is all very helpful as well .",iLife software,1,Software,0,0,0,0,0,1
701,"The computer runs very fast with no problems and the iLife software that comes with it -LRB- iPhoto , iMovie , iWeb , iTunes , GarageBand -RRB- is all very helpful as well .",iPhoto,1,Software,0,0,0,0,0,1
707,At first it worked well for a month or so then the system board failed and I send it in to toshiba some complaints and three weeks later I then receive my laptop back only to discover that it still has the same problem so now I have to send it back again to get it fixed again .,system board,-1,Internal,0,0,1,0,0,0
708,"Until I bought the Dell , I thought you just looked for what you wanted -LRB- size , software , options , hardware -RRB- and purchase the best deal you could find .",size,0,Screen,0,0,0,1,0,0
709,"Until I bought the Dell , I thought you just looked for what you wanted -LRB- size , software , options , hardware -RRB- and purchase the best deal you could find .",software,0,Software,0,0,0,0,0,1
710,"Until I bought the Dell , I thought you just looked for what you wanted -LRB- size , software , options , hardware -RRB- and purchase the best deal you could find .",hardware,0,External,0,1,0,0,0,0
711,"It has plenty of memory , lots of hard drive , and great graphics .",memory,1,Internal,0,0,1,0,0,0
712,"It has plenty of memory , lots of hard drive , and great graphics .",hard drive,1,Internal,0,0,1,0,0,0
713,"It has plenty of memory , lots of hard drive , and great graphics .",graphics,1,Internal,0,0,1,0,0,0
714,It did n't take me long to get switched over to the Mac computer programs and navigation - it 's been just fine and like the way this laptop functions much better .,programs,1,Software,0,0,0,0,0,1
716,"However , my girlfriend realized that the netbook 's hinge is a bit loose -LRB- when you open or close the LCD -RRB- .",hinge,-1,Screen,0,0,0,1,0,0
717,"However , my girlfriend realized that the netbook 's hinge is a bit loose -LRB- when you open or close the LCD -RRB- .",LCD,0,Screen,0,0,0,1,0,0
718,My problem was with DELL Customer Service .,DELL Customer Service,-1,Service,0,0,0,0,1,0
720,Design : very durable .,Design,1,External,0,1,0,0,0,0
721,It is easy to go from one keyboard to another .,keyboard,0,External,0,1,0,0,0,0
722,Has a 5-6 hour battery life .,battery life,0,Battery,1,0,0,0,0,0
723,My ONLY issues are : 1 -RRB- the screen/video resolution wo n't increase to a higher resolution then 1024 x 60,screen/video resolution,-1,Screen,0,0,0,1,0,0
724,My ONLY issues are : 1 -RRB- the screen/video resolution wo n't increase to a higher resolution then 1024 x 60,resolution,-1,Screen,0,0,0,1,0,0
725,"I run Dreamweaver , Final Cut Pro 7 , Photoshop , Safari , Firefox , MSN Messenger and a few other applications constantly at the same time .",applications,0,Software,0,0,0,0,0,1
727,"I run Dreamweaver , Final Cut Pro 7 , Photoshop , Safari , Firefox , MSN Messenger and a few other applications constantly at the same time .",Final Cut Pro 7,0,Software,0,0,0,0,0,1
728,"I run Dreamweaver , Final Cut Pro 7 , Photoshop , Safari , Firefox , MSN Messenger and a few other applications constantly at the same time .",Photoshop,0,Software,0,0,0,0,0,1
729,"I run Dreamweaver , Final Cut Pro 7 , Photoshop , Safari , Firefox , MSN Messenger and a few other applications constantly at the same time .",Safari,0,Software,0,0,0,0,0,1
732,"I was told by many that it was a great computer , but we got one of these , and it worked great for one year , and as soon as the warrenty was up , then it got really bad .",warrenty,-1,Service,0,0,0,0,1,0
733,Ive had to call tech support many times .,tech support,0,Service,0,0,0,0,1,0
735,"The Apple applications -LRB- ex . iPhoto -RRB- are fun , easy , and really cool to use -LRB- unlike the competition -RRB- !",iPhoto,1,Software,0,0,0,0,0,1
737,"I paid for extra memory and the 17-inch screen , as well as the top of the line DVD and CD burners .",memory,0,Internal,0,0,1,0,0,0
738,"I paid for extra memory and the 17-inch screen , as well as the top of the line DVD and CD burners .",17-inch screen,0,Screen,0,0,0,1,0,0
739,"I paid for extra memory and the 17-inch screen , as well as the top of the line DVD and CD burners .",DVD,1,External,0,1,0,0,0,0
740,"I paid for extra memory and the 17-inch screen , as well as the top of the line DVD and CD burners .",CD burners,1,External,0,1,0,0,0,0
741,"Its pretty fast and does not have hiccups while I am using it for web browsing , uploading photos , watching movies -LRB- 720p -RRB- on occasion and creating presentations .",web browsing,1,Software,0,0,0,0,0,1
745,"Quality Display I love HP , , it 's the only computer/printer we will buy .",Quality Display,1,Screen,0,0,0,1,0,0
746,"Despite the inconvenient weight , I opted for the 12 cell battery .",12 cell battery,1,Battery,1,0,0,0,0,0
747,The case is carved out of a single block of aluminum .,case,0,External,0,1,0,0,0,0
748,First it burned or fused the power adapter plug .,power adapter plug,-1,Battery,1,0,0,0,0,0
749,"the features are great , the only thing it needs is better speakers .",features,1,Internal,0,0,1,0,0,0
750,"the features are great , the only thing it needs is better speakers .",speakers,-1,External,0,1,0,0,0,0
751,"It was still working , but there was nothing on the screen .",screen,-1,Screen,0,0,0,1,0,0
754,"- Called headquarters again , they report that TFT panel is broken , should be fixed by the end of the week -LRB- week 3 -RRB- .",TFT panel,-1,Screen,0,0,0,1,0,0
756,"Navigation through the computer is far superior compared to Windows operating systems , as well .",Windows operating systems,-1,Software,0,0,0,0,0,1
757,"The screen is framed by half - to a full-inch margin that is obviously unnecessary , reduces the screen size and increases the bulk .",screen,-1,Screen,0,0,0,1,0,0
758,"The screen is framed by half - to a full-inch margin that is obviously unnecessary , reduces the screen size and increases the bulk .",screen size,-1,Screen,0,0,0,1,0,0
760,"Though the picture , video , and music software is nowhere close to professional grade software Im used to -LRB- CS5 -RRB- but does the job for beginner and even intermediate media designers .",music software,-1,Software,0,0,0,0,0,1
761,"Though the picture , video , and music software is nowhere close to professional grade software Im used to -LRB- CS5 -RRB- but does the job for beginner and even intermediate media designers .",software,1,Software,0,0,0,0,0,1
764,The much lauded combined touch pad and clicker is a nightmare .,combined touch pad and clicker,-1,External,0,1,0,0,0,0
767,I had to re-install Windows within two weeks of the purchase and soon discovered cracks in the screen hinges .,Windows,-1,Software,0,0,0,0,0,1
768,I had to re-install Windows within two weeks of the purchase and soon discovered cracks in the screen hinges .,screen hinges,-1,Screen,0,0,0,1,0,0
