sl,text,aspect,sentiment,Issues,Battery,External,Internal,Screen,Service,Software
1063,the mouse jumps around all the time and it clicks stuff i dont want it too .,mouse,-1,External,0,1,0,0,0,0
1067,"I had my IWORKS , Itunes , Email , MS Office , network and printers set up and completely working perfectly within an hour .",MS Office,1,Software,0,0,0,0,0,1
1068,The macbooks are small enough to be very portable yet hold tons of information and performance .,performance,1,Software,0,0,0,0,0,1
1070,The only downfall is a lot of the software I have wo n't work with Mac and iWork is not worth the price of it .,software,-1,Software,0,0,0,0,0,1
1071,The only downfall is a lot of the software I have wo n't work with Mac and iWork is not worth the price of it .,price,-1,Service,0,0,0,0,1,0
1072,"Whenever tried to turn it on , it would restart as soon as the BIOS launched Windows -LRB- or Winblows , as I like ot call it -RRB- .",BIOS,-1,Software,0,0,0,0,0,1
1073,"Whenever tried to turn it on , it would restart as soon as the BIOS launched Windows -LRB- or Winblows , as I like ot call it -RRB- .",Windows,-1,Software,0,0,0,0,0,1
1074,BUT there 's this application called Boot Camp which allows you to add another OS X like Windows .,application,0,Software,0,0,0,0,0,1
1075,BUT there 's this application called Boot Camp which allows you to add another OS X like Windows .,OS X,0,Software,0,0,0,0,0,1
1077,BUT there 's this application called Boot Camp which allows you to add another OS X like Windows .,Windows,0,Software,0,0,0,0,0,1
1078,The mousepad is a huge pain in the arse !,mousepad,-1,External,0,1,0,0,0,0
1079,"I hope to edit this in the next few hours , I am going to try to install my own copy of Windows 7 .",Windows 7,0,Software,0,0,0,0,0,1
1081,"-RRB- I also purchased Applecare for $ 300 , which is a three year extended warranty , since I ve never seen any laptop that lasted more than two .",extended warranty,0,Service,0,0,0,0,1,0
1082,"I run windows via bootcamp for the couple programs I do not want to buy a mac version of , like my cad programs .",windows,0,Software,0,0,0,0,0,1
1083,"I run windows via bootcamp for the couple programs I do not want to buy a mac version of , like my cad programs .",programs,0,Software,0,0,0,0,0,1
1086,"Whenever I call Dell about an unrelated problem , they ask me if my laptop is running slowly and if I 'd like to purchase more memory for $ 75 .",memory,0,Internal,0,0,1,0,0,0
1090,This time the mouse pad and right click key would n't work !,mouse pad,-1,External,0,1,0,0,0,0
1091,This time the mouse pad and right click key would n't work !,right click key,-1,External,0,1,0,0,0,0
1092,The first full charge of this battery got me only about 2 full hours .,battery,-1,Battery,1,0,0,0,0,0
1093,The first full charge of this battery got me only about 2 full hours .,full charge,-1,Battery,1,0,0,0,0,0
1098,They only stay charged a little over an hour .,charged,-1,Battery,1,0,0,0,0,0
1099,I could not find a phone number anywhere to call an actual live person for tech support and had to result the their online chat .,tech support,-1,Service,0,0,0,0,1,0
1101,Keyboard could use some trimming .,Keyboard,-1,External,0,1,0,0,0,0
1102,Its white color is stylish for college students and easy to take to carry and take to classes .,color,1,Service,0,0,0,0,1,0
1103,"Returned laptop for repair a 2nd time and it came back with obvious physical damage -LRB- keyboard bulging and speaker grill pressed in -RRB- , buttons not working and USB ports inoperative .",keyboard,-1,External,0,1,0,0,0,0
1104,"Returned laptop for repair a 2nd time and it came back with obvious physical damage -LRB- keyboard bulging and speaker grill pressed in -RRB- , buttons not working and USB ports inoperative .",speaker grill,-1,External,0,1,0,0,0,0
1105,"Returned laptop for repair a 2nd time and it came back with obvious physical damage -LRB- keyboard bulging and speaker grill pressed in -RRB- , buttons not working and USB ports inoperative .",buttons,-1,External,0,1,0,0,0,0
1106,"Returned laptop for repair a 2nd time and it came back with obvious physical damage -LRB- keyboard bulging and speaker grill pressed in -RRB- , buttons not working and USB ports inoperative .",USB ports,-1,External,0,1,0,0,0,0
1107,I got assurances from 2 different people that the remaining 10 months of my warranty would transfer to the new computer .,warranty,1,Service,0,0,0,0,1,0
1110,I took off a star because the machine has a lot of junk software on it .,software,-1,Software,0,0,0,0,0,1
1112,Tried to make a recovey disk wouldnt get passed the first recovery disk .,recovey disk,-1,Internal,0,0,1,0,0,0
1113,Tried to make a recovey disk wouldnt get passed the first recovery disk .,recovery disk,-1,Software,0,0,0,0,0,1
1117,"For the same price , you get a lot more in the Asus ... 1920x1080 res .",price,-1,Service,0,0,0,0,1,0
1120,"I use this for my tutoring business , and since I 'm always bouncing from student to student , it is ideal for portability and battery life -LRB- yes , it gets the 8 hours as advertised ! -RRB- .",battery life,1,Battery,1,0,0,0,0,0
1121,It is in the best condition and has a really high quality .,quality,1,Service,0,0,0,0,1,0
1123,However the frozen screens kept happening .,screens,-1,Screen,0,0,0,1,0,0
1124,"It is short on space , and downloads always had problems being completed , or were said to be ` corrupted ' .",space,-1,Internal,0,0,1,0,0,0
1125,"It is short on space , and downloads always had problems being completed , or were said to be ` corrupted ' .",downloads,-1,Software,0,0,0,0,0,1
1126,3 -RRB- Horrible customer support,customer support,-1,Service,0,0,0,0,1,0
1130,The downside to this netbook is pretty much the same for any netbook : screen size is not something I 'd stare at for the entire 10-11 hours of battery life five days a week .,screen size,0,Screen,0,0,0,1,0,0
1131,The downside to this netbook is pretty much the same for any netbook : screen size is not something I 'd stare at for the entire 10-11 hours of battery life five days a week .,battery life,0,Battery,1,0,0,0,0,0
1132,The graphics are great .,graphics,1,Internal,0,0,1,0,0,0
1133,in 5 months the connect quality got worse and worse .,connect quality,-1,Internal,0,0,1,0,0,0
1134,"The big screen allows you to enjoy watching movies , pictures and etc !",screen,1,Screen,0,0,0,1,0,0
1135,"the headphone and mic jack are in front of touch-pad making the touch-pad hard to use when using headphones/mic , not to mention the laptop was designed for right handed person .",headphone,-1,External,0,1,0,0,0,0
1136,"the headphone and mic jack are in front of touch-pad making the touch-pad hard to use when using headphones/mic , not to mention the laptop was designed for right handed person .",mic jack,-1,External,0,1,0,0,0,0
1139,"the headphone and mic jack are in front of touch-pad making the touch-pad hard to use when using headphones / mic , not to mention the laptop was designed for right handed person .",headphones,-1,External,0,1,0,0,0,0
1140,"the headphone and mic jack are in front of touch-pad making the touch-pad hard to use when using headphones / mic , not to mention the laptop was designed for right handed person .",mic,-1,External,0,1,0,0,0,0
1141,For the -LSB- $ -RSB- price -LRB- special offer -RRB- this is a great laptop .,price,1,Service,0,0,0,0,1,0
1142,the manufacturer 's warranty only covers replacement/repair of parts .,warranty,-1,Service,0,0,0,0,1,0
1143,What I 'd like is for the laptop to run well without having to purchase additional memory .,memory,-1,Internal,0,0,1,0,0,0
1147,"It is fast booting up , shutting down , and connection with the internet .",booting up,1,Software,0,0,0,0,0,1
1149,The battery life is great .,battery life,1,Battery,1,0,0,0,0,0
1150,This is not a serious gaming laptop or a serious media machine ;,gaming,-1,Software,0,0,0,0,0,1
1151,They replaced my hard drive as well as my mother board .,hard drive,0,Internal,0,0,1,0,0,0
1152,They replaced my hard drive as well as my mother board .,mother board,0,Internal,0,0,1,0,0,0
1153,There is nothing to complain about the system .,system,1,Internal,0,0,1,0,0,0
1154,and it comes with the new OSX that comes with new features that makes the use more easy .,OSX,1,Software,0,0,0,0,0,1
1155,and it comes with the new OSX that comes with new features that makes the use more easy .,features,1,Internal,0,0,1,0,0,0
1157,"Now the screen is going darker , darker , darker .",screen,-1,Screen,0,0,0,1,0,0
1159,EITHER THE COMPUTER IS TOO SLOW TO DETECT THE KEYS TYPED -LRB- THIS IS UNLIKELY AS I AM A SLOW TYPIST -RRB- OR THE KEYBOARD SIMPLY DOES NOT DETECT THE KEYS BEING TYPED .,KEYBOARD,-1,External,0,1,0,0,0,0
1164,"I sent it back and found this time that the battery was faulty , so I got a new one and some other fixes they found .",battery,-1,Battery,1,0,0,0,0,0
1174,The only thing is that the battery wo n't last more than 1/2 an hour .,battery,-1,Battery,1,0,0,0,0,0
1177,The keyboard has a wonderful nature feel .,keyboard,1,External,0,1,0,0,0,0
1178,"They went through asking me open up various components , taking battery out , hard disk apart , and after 2 hours on phone could not fix it .",battery,0,Battery,1,0,0,0,0,0
1179,"They went through asking me open up various components , taking battery out , hard disk apart , and after 2 hours on phone could not fix it .",hard disk,0,External,0,1,0,0,0,0
1180,The battery does n't last long but I 'm sure an upgrade battery would solve that problem .,battery,-1,Battery,1,0,0,0,0,0
1181,The battery does n't last long but I 'm sure an upgrade battery would solve that problem .,battery,1,Battery,1,0,0,0,0,0
1183,"I was looking too closely at the other performance specs and while comparing , I took it for granted that these features were standard .",features,0,Internal,0,0,1,0,0,0
1184,I have no idea how this could have even gotten past quality control during production .,quality control,-1,Software,0,0,0,0,0,1
1186,"Oh yea , has no numeric pad on the side .",numeric pad,-1,External,0,1,0,0,0,0
1188,"The cover for the DVD drive soon came off , too -- a mark of poor construction quality .",construction quality,-1,Service,0,0,0,0,1,0
1190,The software is amazing .,software,1,Software,0,0,0,0,0,1
1191,"We carry the netbook around here and there , hence it 's kinda of irritating when the LCD just `` slide '' downwards .",LCD,-1,Screen,0,0,0,1,0,0
1193,"The 2 GB of RAM is plenty , able to run Windows 7 and at least 2 or 3 other programs with next to no slowdown .",Windows 7,1,Software,0,0,0,0,0,1
1194,"The 2 GB of RAM is plenty , able to run Windows 7 and at least 2 or 3 other programs with next to no slowdown .",programs,1,Software,0,0,0,0,0,1
1195,"The battery life is amazing , the versitility is outstanding .",battery life,1,Battery,1,0,0,0,0,0
1197,"It is known as Safari , and if you are doing any website work , you should know that many hosting companies do not support it .",Safari,0,Software,0,0,0,0,0,1
1198,Vista is a nightmare .,Vista,-1,Software,0,0,0,0,0,1
1199,The program came with the computer and works beautifully .,program,1,Software,0,0,0,0,0,1
1200,"the hinge design forced you to place various connections all around the computer , left right and front .",hinge design,-1,Screen,0,0,0,1,0,0
1201,"I was loving this Netbook because it had an amazing screen and display and was small and light , but after 1 week it stopped openning web pages for me -LRB- even after installing new browsers -RRB- then eventually it just started giving me a blue screen and crashing everytime I booted it .",screen,1,Screen,0,0,0,1,0,0
1202,"I was loving this Netbook because it had an amazing screen and display and was small and light , but after 1 week it stopped openning web pages for me -LRB- even after installing new browsers -RRB- then eventually it just started giving me a blue screen and crashing everytime I booted it .",display,1,Screen,0,0,0,1,0,0
1206,I dislike the quality and the placement of the speakers .,speakers,-1,External,0,1,0,0,0,0
1210,"So I called customer support -LRB- which is good too -RRB- and they went through it and it is just a safety feature and it does not affect performance at all , I just chose to hide the message .",customer support,1,Service,0,0,0,0,1,0
1211,"So I called customer support -LRB- which is good too -RRB- and they went through it and it is just a safety feature and it does not affect performance at all , I just chose to hide the message .",performance,0,Software,0,0,0,0,0,1
1217,Later it held zero charge and its replacement worked for less than three months .,charge,-1,Battery,1,0,0,0,0,0
1218,"Also , the battery does not last very long at all .",battery,-1,Battery,1,0,0,0,0,0
1219,"I bought it from HSN because it was `` bundled '' with extra software , but as it turns out , that software just crashes it more often ...",software,-1,Software,0,0,0,0,0,1
1220,I looked around and based off my price / features comparison from a brand I trusted I landed here .,price,0,Service,0,0,0,0,1,0
1221,I looked around and based off my price / features comparison from a brand I trusted I landed here .,features,0,Internal,0,0,1,0,0,0
1223,Strong performance in this device makes use of fun and a strong sense of the era of speed This device serves all modern requirements is a very strong game and is very useful for designers .,performance,1,Software,0,0,0,0,0,1
1227,I was sorly disapointed to discover that HP -LRB- what I thought was a reputable company -RRB- would n't honor the warrenty when the fan blade fell apart .,warrenty,-1,Service,0,0,0,0,1,0
1228,I was sorly disapointed to discover that HP -LRB- what I thought was a reputable company -RRB- would n't honor the warrenty when the fan blade fell apart .,fan blade,-1,External,0,1,0,0,0,0
1229,"More times that not the screen pops up saying I have a bad internet connection , or the page ca n't be displayed .",internet connection,-1,Internal,0,0,1,0,0,0
1230,Do yourself a favor and invest in a few external harddrives if you are planning on purchasing this laptop .,external harddrives,-1,External,0,1,0,0,0,0
1231,I do n't understand why only Windows 7 Starter is included .,Windows 7 Starter,-1,Software,0,0,0,0,0,1
1235,"While most people say that PCs hold functionality and value and Macs are just pretty to look at , I think there 's something to be said about the simplicity of Macs .",look,1,External,0,1,0,0,0,0
1238,This system came loaded with Windows 7 Starter .,Windows 7 Starter,0,Software,0,0,0,0,0,1
1239,"- When battery life went to 4 hours or less , took it to the MacHouse Amsterdam for repair -LRB- 26th of August -RRB- .",battery life,-1,Battery,1,0,0,0,0,0
1240,The battery gets so HOT it is scary .,battery,-1,Battery,1,0,0,0,0,0
1241,Best thing is I can use existing 32 bit old programs .,programs,1,Software,0,0,0,0,0,1
1242,It 's so nice to look at and the keys are easy to type with .,keys,1,Software,0,0,0,0,0,1
1243,It 's so nice to look at and the keys are easy to type with .,look,1,External,0,1,0,0,0,0
1244,I am forever changed and will no longer buy a Windows based machine for personal use .,Windows,-1,Software,0,0,0,0,0,1
1245,The only thing I would change about it is the mouse keys .,mouse keys,-1,External,0,1,0,0,0,0
1246,"It is absolutely horrible to use , despite all its so called advanced features .",features,-1,Internal,0,0,1,0,0,0
1248,"Before , I reloaded with Windows 7 Ultimate and used only the downloaded drivers from Acer 's site .",drivers,0,Internal,0,0,1,0,0,0
1249,"Before , I reloaded with Windows 7 Ultimate and used only the downloaded drivers from Acer 's site .",Windows 7 Ultimate,0,Software,0,0,0,0,0,1
1252,After that I turned to email in my next vain help to get them to acknowledge that the warranty was still valid .,warranty,0,Service,0,0,0,0,1,0
1254,"u can do what u want in just few seconds , even to start up your computer takes few seconds .",start up,1,Internal,0,0,1,0,0,0
1255,"Also , macbooks come with much more features which are so cool !",features,1,Internal,0,0,1,0,0,0
1259,overall i would recomend this to anybody and tell them that if they want to burn their music or play there video games to buy the cd drive .,cd drive,0,External,0,1,0,0,0,0
1261,"I am constantly trying to uninstall programs , clean cookies , and delete unused files .",programs,0,Software,0,0,0,0,0,1
1262,"The dv4 boasted a faster processor , more memory , and a bigger hard drive than my old computer , plus a better quality web cam , nicer screen , and many other features .",processor,1,Internal,0,0,1,0,0,0
1263,"The dv4 boasted a faster processor , more memory , and a bigger hard drive than my old computer , plus a better quality web cam , nicer screen , and many other features .",memory,1,Internal,0,0,1,0,0,0
1264,"The dv4 boasted a faster processor , more memory , and a bigger hard drive than my old computer , plus a better quality web cam , nicer screen , and many other features .",hard drive,1,Internal,0,0,1,0,0,0
1265,"The dv4 boasted a faster processor , more memory , and a bigger hard drive than my old computer , plus a better quality web cam , nicer screen , and many other features .",web cam,1,Internal,0,0,1,0,0,0
1266,"The dv4 boasted a faster processor , more memory , and a bigger hard drive than my old computer , plus a better quality web cam , nicer screen , and many other features .",screen,1,Screen,0,0,0,1,0,0
1267,"The dv4 boasted a faster processor , more memory , and a bigger hard drive than my old computer , plus a better quality web cam , nicer screen , and many other features .",features,1,Internal,0,0,1,0,0,0
1268,The only downfall is the battery only last 1.5-2 .0 hrs when not plugged in .,battery,-1,Battery,1,0,0,0,0,0
1269,The graphics on this computer are also stellar - very clear and vivid .,graphics,1,Internal,0,0,1,0,0,0
1270,"Aside from the trial software and the short battery life , lack of a webcam , its great .",trial software,-1,Software,0,0,0,0,0,1
1271,"Aside from the trial software and the short battery life , lack of a webcam , its great .",battery life,-1,Battery,1,0,0,0,0,0
1272,"Aside from the trial software and the short battery life , lack of a webcam , its great .",webcam,-1,External,0,1,0,0,0,0
1273,"As a die-hard Windows enthusiast , I shunned the idea of a Mac until this point .",Windows,1,Software,0,0,0,0,0,1
1274,I think that if it is the motherboard again so soon that they should replace it .,motherboard,-1,Internal,0,0,1,0,0,0
1275,"The computer loads in about a 1/10th of the time that my PC did , and I have all of the programs that were on my PC .",programs,1,Software,0,0,0,0,0,1
1279,"The newer black keyboard took a little bit away from the previous gray one which looked really slick , but it is still a great notebook !",black keyboard,-1,External,0,1,0,0,0,0
1280,Sony parts reliability and quality of service is recenlty the worst .,service,-1,Service,0,0,0,0,1,0
1281,"As with any laptop not purchased with software options , it comes with a lot of what I consider useless applications .",software options,-1,Software,0,0,0,0,0,1
1282,"As with any laptop not purchased with software options , it comes with a lot of what I consider useless applications .",applications,-1,Software,0,0,0,0,0,1
1283,"Its Office compatible , but the features and its functioning is all new again so you might as well save the money and just learn the pre installed mac programs .",features,0,Internal,0,0,1,0,0,0
1285,"Its Office compatible , but the features and its functioning is all new again so you might as well save the money and just learn the pre installed mac programs .",programs,0,Software,0,0,0,0,0,1
1288,"Do you think I purposely `` destroy '' my netbook , so that I can demand a new set ? Do you think it 's fun to take public transport all the way to the service center and get a non-satisfactory solution ? Or rather NO solution .",service center,-1,Service,0,0,0,0,1,0
1289,I 'm having the laptop returned unrepaired since paying $ 176 every 3 months just is n't worth it -LRB- that 's about how long the port seems to last -RRB- .,port,-1,Internal,0,0,1,0,0,0
1290,also the battery is completely shot .,battery,-1,Battery,1,0,0,0,0,0
1291,/ awesome cooling system / much better grafics card -LRB- ATI 5870 -RRB- / 8GB RAM / LED backlit screen ...,cooling system,1,External,0,1,0,0,0,0
1300,Screen is crystal clear and the system is very responsive .,Screen,1,Screen,0,0,0,1,0,0
1301,Screen is crystal clear and the system is very responsive .,system,1,Internal,0,0,1,0,0,0
1302,Or the cursor would show up some place else .,cursor,-1,Screen,0,0,0,1,0,0
1303,It is easy to operate and I have already ordered more software and gadgets for my new Rolls Royce of laptops .,software,0,Software,0,0,0,0,0,1
1306,"it might be something deep within Windows , for I was unable to create a disk image on my hard drive .",Windows,-1,Software,0,0,0,0,0,1
1307,"it might be something deep within Windows , for I was unable to create a disk image on my hard drive .",hard drive,-1,Internal,0,0,1,0,0,0
1308,"it might be something deep within Windows , for I was unable to create a disk image on my hard drive .",disk image,-1,Software,0,0,0,0,0,1
1309,"The track pad to me is what really stands out though , you can do several different things with it just depending on how many fingers you use on the track pad , awesome thinking Apple !",track pad,1,External,0,1,0,0,0,0
1310,"The track pad to me is what really stands out though , you can do several different things with it just depending on how many fingers you use on the track pad , awesome thinking Apple !",track pad,1,External,0,1,0,0,0,0
1311,"Now I had not tried to use this since the disc drive had been replaced and after taking it back to the Geek Squad I found out they had accidently not used the right drive when they replaced the first one , so back it went to get the correct drive .",disc drive,-1,External,0,1,0,0,0,0
1312,"Now I had not tried to use this since the disc drive had been replaced and after taking it back to the Geek Squad I found out they had accidently not used the right drive when they replaced the first one , so back it went to get the correct drive .",drive,-1,Internal,0,0,1,0,0,0
1313,"Now I had not tried to use this since the disc drive had been replaced and after taking it back to the Geek Squad I found out they had accidently not used the right drive when they replaced the first one , so back it went to get the correct drive .",drive,0,Internal,0,0,1,0,0,0
1315,"First , you ll discover that the word processing program known as Appleworks rarely translates perfectly on anyone else s computer , if it translates at all .",word processing program,-1,Software,0,0,0,0,0,1
1316,I already have a HP laptop I bought last year that 's standard size .,size,0,Screen,0,0,0,1,0,0
1317,Battery is not upgradable to a longer life battery .,Battery,-1,Battery,1,0,0,0,0,0
1318,Battery is not upgradable to a longer life battery .,battery,-1,Battery,1,0,0,0,0,0
1320,Returned laptop for a 3rd repair and it came back with previous problems fixed -LRB- except for speaker grill -RRB- but the unit started locking up during use and eventually would not operate at all .,speaker grill,-1,External,0,1,0,0,0,0
1321,I just plug this into my 22 '' Monitor and the speedy MacOSX performs just as well on this dual-core that my Dell did with Windows 7 with a quad-core .,MacOSX,1,Software,0,0,0,0,0,1
1322,I just plug this into my 22 '' Monitor and the speedy MacOSX performs just as well on this dual-core that my Dell did with Windows 7 with a quad-core .,Windows 7,1,Software,0,0,0,0,0,1
1325,"I just plug this into my 22"" Monitor and the speedy MacOSX performs just as well on this dual-core that my Dell did with Windows 7 with a quad-core .","22"" Monitor",0,External,0,1,0,0,0,0
1326,"Love the graphics , awesome programs -LRB- including Garageband -RRB- , and really cool default background .",graphics,1,Internal,0,0,1,0,0,0
1327,"Love the graphics , awesome programs -LRB- including Garageband -RRB- , and really cool default background .",programs,1,Software,0,0,0,0,0,1
1330,"Screen , keyboard , and mouse : If you cant see yourself spending the extra money to jump up to a Mac the beautiful screen , responsive island backlit keyboard , and fun multi-touch mouse is worth the extra money to me alone .",Screen,0,Screen,0,0,0,1,0,0
1331,"Screen , keyboard , and mouse : If you cant see yourself spending the extra money to jump up to a Mac the beautiful screen , responsive island backlit keyboard , and fun multi-touch mouse is worth the extra money to me alone .",keyboard,0,External,0,1,0,0,0,0
1332,"Screen , keyboard , and mouse : If you cant see yourself spending the extra money to jump up to a Mac the beautiful screen , responsive island backlit keyboard , and fun multi-touch mouse is worth the extra money to me alone .",screen,1,Screen,0,0,0,1,0,0
1333,"Screen , keyboard , and mouse : If you cant see yourself spending the extra money to jump up to a Mac the beautiful screen , responsive island backlit keyboard , and fun multi-touch mouse is worth the extra money to me alone .",island backlit keyboard,1,External,0,1,0,0,0,0
1334,"Screen , keyboard , and mouse : If you cant see yourself spending the extra money to jump up to a Mac the beautiful screen , responsive island backlit keyboard , and fun multi-touch mouse is worth the extra money to me alone .",multi-touch mouse,1,External,0,1,0,0,0,0
1335,"Screen , keyboard , and mouse : If you cant see yourself spending the extra money to jump up to a Mac the beautiful screen , responsive island backlit keyboard , and fun multi-touch mouse is worth the extra money to me alone .",mouse,0,External,0,1,0,0,0,0
1337,The OS takes some getting used to especially after being a Windows user for so long but the learning curve is so worth it !,Windows,0,Software,0,0,0,0,0,1
